dbn,username,borough,grade_level,enrollment,comment,likes,dislikes,replies,post_date,fam_comm_ties,pct_ell,pct_disabilities,pct_self_contained,economic_need_index,pct_temp_housing,pct_hra_eligible,pct_asian,pct_black,pct_hispanic,pct_white,pct_chronic_absent
25Q025,lashawn sams,queens,Middle,1053,"Austin, a recent graduate, writes: ""The teachers try really hard to do their best to teach the class, but a lot of the time a large group of students disrupt the class and don't pay attention, another problem is that there are many fights in the hallways and classrooms... I also didn't have an English teacher for 3/4 of the year, only subs which gave us free time and a high grade on the report card for doing nothing.""",0,0,0,2004-12-15T18:45:09,0.5,0.12,0.147,0.043,0.621,0.062,0.419,0.556,0.019,0.23199999999999998,0.179,0.076
25Q025,carolscott,queens,Middle,1053,"An alumna writes: ""I loved IS 25!! It is such an excellent school! I truly enjoyed my 8th grade and especially my freshmen year at IS 25!! My teachers have made me become successful in high school!! You get an excellent education with excellent teachers.""",0,0,0,2004-12-15T18:44:15,0.5,0.12,0.147,0.043,0.621,0.062,0.419,0.556,0.019,0.23199999999999998,0.179,0.076
25Q025,Jayla127,queens,Middle,1053,"Parent Jennifer Fertile believes the school focuses too much on discipline: ""I know that it is necessary to stress rules and regulations in a junior high school setting, but I feel that the school should balance this information with what wonderful experiences the children can expect and look forward to as well. Many of the children are coming from schools where they have been nurtured and felt like they were part of a 'FAMILY.' It is a shame that the actions of a few have to be the prevailing theme throughout the day.""",0,0,0,2004-11-29T19:47:35,0.5,0.12,0.147,0.043,0.621,0.062,0.419,0.556,0.019,0.23199999999999998,0.179,0.076
25Q029,chait2,queens,Elementary,667,"As an unbiased visitor to this school, I was very impressed by a recent 4th grade performance of the musical, ""Matilda"". A role is found for any child that wants to participate, whether it is onstage or backstage. Actors, including ESL students, learn to project their voices, speak clearly, and learn to emote. Students paint scenery, man the stage lights, hand out programs. Scenery, set design and costuming are part of the show. Since Matilda was a musical, students sang and danced out into the aisles. It was an amazing show! It was announced that the arts department put about 10 of these shows together this year.I have seen performances in other elementary schools and this was head and shoulders above any other I have seen. Kudos to the arts department!",0,0,0,2016-05-15T19:37:57,1.0,0.294,0.205,0.018000000000000002,0.131,0.067,0.66,0.259,0.012,0.63,0.094,0.16
25Q029,lilia0oxxx,queens,Elementary,667,"haha!! oh my god, I was in that play, and im going to 8th grade!! thanks so much, even though I didn't actually have a part in the play :) and you probably wont see this any time soon.",0,0,1,2019-07-26T14:45:34,1.0,0.294,0.205,0.018000000000000002,0.131,0.067,0.66,0.259,0.012,0.63,0.094,0.16
25Q029,newslink,queens,Elementary,667,"Parents, teachers and a state senator call for the removal of the principal, Jennifer Jones-Rogers, charging that she ""is abusive to staff and students"" and that 25 of the 45 teachers have left since she became principal in 2010. Read more:<a href=""http://www.nydailynews.com/new-york/queens/parents-principal-fired-queens-article-1.1414885"">Teachers and parents call for removal of College Point principal at PS 29</a>.",0,0,0,2013-08-05T14:32:59,1.0,0.294,0.205,0.018000000000000002,0.131,0.067,0.66,0.259,0.012,0.63,0.094,0.16
25Q029,parent,queens,Elementary,667," i agree with some of the comment below except for the security, i am very thankful they always ckecked my child to be safe when she left the school time, yes the pta is useless but i have a lot of help and consideration for my child from the YMCA afterschool. the school is going downhill, lets see how is with the new principal (jones) but this year i see nothing",4,0,0,2011-05-23T19:36:58,1.0,0.294,0.205,0.018000000000000002,0.131,0.067,0.66,0.259,0.012,0.63,0.094,0.16
25Q029,parent,queens,Elementary,667,"<p>""My daughter has been going to this school for 5 years and its only going downhill since the new principal (adams) took over. The PTA is useless and the afterschool help is a joke. Over packed classroooms are just one of the many problems wrong with the school. I feel very sorry for the teachers that have been there for a long time that have to deal with the new principal and her ""changes"". Now you can't even take the kids up to the front door, but only through the back entrance thru the school yard which is stupid and there is no secruity watching anyone back there. Yet the PTA parents can bring their kids thru the front entrance so they dont have to walk the extra block. The school also does not take enough disciplinary action against the students not following rules. Im taking my child to St fidelis instead for the next school year, i have had it with public schools.""</p>",3,0,0,2009-02-15T23:19:55,1.0,0.294,0.205,0.018000000000000002,0.131,0.067,0.66,0.259,0.012,0.63,0.094,0.16
25Q029,Anonymous,queens,Elementary,667,"Building on school's strong achievements in reading and math, Principal Jamie Adams aims to ramp up social studies and science learning, too. ""Our priority was on math and reading. Our teachers have mastered the model,"" she says. ""Now, it's time to transfer that knowledge to science and social studies.""",1,0,0,2006-12-19T18:36:49,1.0,0.294,0.205,0.018000000000000002,0.131,0.067,0.66,0.259,0.012,0.63,0.094,0.16
25Q029,Anonymous,queens,Elementary,667,"<P>A parent active in the PTA said her kids liked the music and dance programs offered at the school. She said the school's after-school programs are ""really very school-oriented. They're not about having fun,"" so the PTA offers workshops for parents and kids including arts and crafts, and dance. </P>",0,0,0,2004-06-22T21:23:56,1.0,0.294,0.205,0.018000000000000002,0.131,0.067,0.66,0.259,0.012,0.63,0.094,0.16
25Q032,newslink,queens,Elementary,959,"PS 32 has won several awards for “outstanding programs in recycling, sustainability, reuse, gardening or cleanup,” including their Activate Our Garden and Ocean Plastic Awareness programs. “We are proud to be a Queens school that promotes nature-based programs and sustainability programs,” PTA co-president and founder of both programs Wing Kong told <a href=""https://qns.com/story/2019/05/30/activate-our-garden-program-at-flushing-public-school-teaches-students-about-the-environment-and-sustainability/?utm_source=newsletter&utm_medium=email&utm_campaign=cb_bureau_ny"">QNS.com</a>.",1,0,0,2019-05-31T15:15:50,1.0,0.147,0.122,0.046,0.37799999999999995,0.031,0.494,0.703,0.006999999999999999,0.168,0.094,0.09699999999999999
25Q032,Donna Apple D.,queens,Elementary,959,"My son is in Pre-K this year at PS 32, but his teacher is not very caring nor helpful. The teacher is not approachable and gets annoyed very easily if a few parents ask her the same question more than once.  I don't think the teacher understands that for some of the parents, this is our first child which means lots of adjustment for the child as well as for the parents ourselves. We parents ask question not because we don't check the notices that get sent home or we don't care to read, but it's because as new parents we do not know how the school system works or we're not sure if we fully understand.  We had our parent teacher conference this week and the teacher made us feel like we are not doing our part at all to help our child to succeed.  We left the school feeling very frustrated and broken...",0,0,0,2018-11-17T05:02:43,1.0,0.147,0.122,0.046,0.37799999999999995,0.031,0.494,0.703,0.006999999999999999,0.168,0.094,0.09699999999999999
25Q032,Insideschools,queens,Elementary,959,"PS 32 offers a dual language program in Korean and English, the first on the East coast to do so.

http://steinhardt.nyu.edu/scmsAdmin/uploads/005/591/PS_32_Korean_DL_Prog.pdf",0,0,0,2016-06-04T05:27:07,1.0,0.147,0.122,0.046,0.37799999999999995,0.031,0.494,0.703,0.006999999999999999,0.168,0.094,0.09699999999999999
25Q032,DavidW,queens,Elementary,959,"I attended PS 32 in the '50s! Good to see it still thriving. My memories include cleaning erasers on a vacuum machine in the basement (an honor for good behavior), being in the ""control group"" for Salk Vaccine clinical trials (got the saline, and when they approved the vaccine for wide use, had to get the ""real stuff""), learning French in the 3rd grade, and a school wide science exploration for an entire year in 1957/8 to correspond with the International Geophysical Year (http://en.wikipedia.org/wiki/International_Geophysical_Year), a global exploration involving 67 countries that, among other successes, led to discovery of the Van Allen Belt around the earth and of Spandex (!). Very much part of the Cold War competition, it was during this year that the Soviet Union surprised the world with the launch of Sputnik.",0,0,0,2013-11-14T15:56:16,1.0,0.147,0.122,0.046,0.37799999999999995,0.031,0.494,0.703,0.006999999999999999,0.168,0.094,0.09699999999999999
25Q032,yolie71,queens,Elementary,959,"I visited G&T Open House for entry this Fall 2013. Tour and presentation well-run. Principal was great, very informative and took the time to answer all of our questions. Seems to have great academics, music, and enrichment activities. Overall I liked the school and what it offers. Any P32 parents with feedback about your experience at this school welcomed.",0,0,0,2013-05-06T17:39:51,1.0,0.147,0.122,0.046,0.37799999999999995,0.031,0.494,0.703,0.006999999999999999,0.168,0.094,0.09699999999999999
25Q032,anonymous,queens,Elementary,959,"My son is finishing 130 this year and would naturally go to 32 as his districted school for 4 and 5 grade. I see that the schoold only got a ""C"" on its city ""report card"" this year? Are there any recent problems in the school that would impact my son's experience? ",0,0,0,2012-02-02T14:31:08,1.0,0.147,0.122,0.046,0.37799999999999995,0.031,0.494,0.703,0.006999999999999999,0.168,0.094,0.09699999999999999
25Q032,truth,queens,Elementary,959,"The Principle is new and young. She is very unresponsive to the parent's concern regarding important issues. The teachers and aides are very mean. They yell at the kids at the top of their lung at the regular basis. The fifth graders who are assigned as the lunch monitor are also mean and hurting the smaller kids physically. When the incidents was reported to the administration, they refuse to believe. I took my kids out and I'm so glad to do that.",0,0,1,2012-05-15T14:29:51,1.0,0.147,0.122,0.046,0.37799999999999995,0.031,0.494,0.703,0.006999999999999999,0.168,0.094,0.09699999999999999
25Q032,Alfred Gallo,queens,Elementary,959,My daughter is entering First Grade at PS 32 and we wanted to know if anyone uses Stephanie Transportation? We live about 2.5 miles from PS 32 and do not want to put her ona DOE bus.,0,0,0,2011-08-29T20:05:46,1.0,0.147,0.122,0.046,0.37799999999999995,0.031,0.494,0.703,0.006999999999999999,0.168,0.094,0.09699999999999999
25Q032,2nd grade mom,queens,Elementary,959,"A new principal --Debra Errico-- just started in Fall of 2010. She's young and motivated and, so far, seems to be liked. There is also an afterschool program that started this year. It's run by the Samuel Field Y. The parent coordinator, Karen Mascetti, does a great job organizing workshops and events for the students/families. The PTA is pretty active and helps the school in many ways. My son is in the 2nd grade and, overall, we're happy with the school!",1,0,0,2011-01-28T22:03:52,1.0,0.147,0.122,0.046,0.37799999999999995,0.031,0.494,0.703,0.006999999999999999,0.168,0.094,0.09699999999999999
25Q032,Anonymous,queens,Elementary,959,"PS 32 was identified by <A href=""http://www.schoolmatters.com/pdf/achievement-gap/ny-achievement-gap-schools-schoolmatters.pdf"">Standard and Poor's School Evaluation Services</A> as having reduced the achievement gap between its students who are economically disadvantaged and those who are not.",0,0,0,2006-11-21T15:43:34,1.0,0.147,0.122,0.046,0.37799999999999995,0.031,0.494,0.703,0.006999999999999999,0.168,0.094,0.09699999999999999
25Q032,Anonymous,queens,Elementary,959,"""Parents are always here. There are always writing celebrations with parents here,"" said the assistant principal.",0,0,0,2006-04-21T16:15:13,1.0,0.147,0.122,0.046,0.37799999999999995,0.031,0.494,0.703,0.006999999999999999,0.168,0.094,0.09699999999999999
25Q032,Anonymous,queens,Elementary,959,"""This is a calm school,"" said Principal Betsey Malesardi. ""When you walk around, you know the children are learning.""",0,0,0,2006-04-21T16:15:02,1.0,0.147,0.122,0.046,0.37799999999999995,0.031,0.494,0.703,0.006999999999999999,0.168,0.094,0.09699999999999999
25Q032,Anonymous,queens,Elementary,959,"""I like everything about the school,"" a 6th grader said. ""The PTA is really nice.""",0,0,0,2006-04-21T16:14:52,1.0,0.147,0.122,0.046,0.37799999999999995,0.031,0.494,0.703,0.006999999999999999,0.168,0.094,0.09699999999999999
25Q032,Anonymous,queens,Elementary,959,"""My kids used to go to Catholic school,"" said a mother who transferred her son in. ""They're not drilling for the tests. He's very happy here. There's more social life here.""",0,0,0,2006-04-21T16:14:43,1.0,0.147,0.122,0.046,0.37799999999999995,0.031,0.494,0.703,0.006999999999999999,0.168,0.094,0.09699999999999999
25Q032,Anonymous,queens,Elementary,959,"""We like the teachers. We're impressed,"" said a father who immigrated to the U.S. from Ireland.",0,0,0,2006-04-21T16:14:34,1.0,0.147,0.122,0.046,0.37799999999999995,0.031,0.494,0.703,0.006999999999999999,0.168,0.094,0.09699999999999999
25Q032,Kolbasyn,queens,Elementary,959,"""The teachers are great, the guidance is awesome, and we have Family Fun nights,"" writes student Shanice. ""We usually have performances and goodies through out the school.""",0,0,0,2005-10-14T14:19:21,1.0,0.147,0.122,0.046,0.37799999999999995,0.031,0.494,0.703,0.006999999999999999,0.168,0.094,0.09699999999999999
25Q079,anonymousps79,queens,Elementary,1052,"School has gifted and talented class this year, but not as good as I expected. Honestly school have lots things need to be improved. I really regret to choose this school for my kid.",10,0,0,2012-09-15T23:01:12,1.0,0.125,0.128,0.02,0.64,0.039,0.33899999999999997,0.5379999999999999,0.005,0.20199999999999999,0.243,0.09300000000000001
25Q079,Anonymous,queens,Elementary,1052,"According to the Quality Review Report, ""There are many extra curricular experiences provided for the students. The school tons is established and maintained through changing monthly themes to build good character traits.""",1,0,0,2007-04-16T21:20:33,1.0,0.125,0.128,0.02,0.64,0.039,0.33899999999999997,0.5379999999999999,0.005,0.20199999999999999,0.243,0.09300000000000001
25Q079,Anonymous,queens,Elementary,1052,"PS 79 was identified by <A href=""http://www.schoolmatters.com/pdf/achievement-gap/ny-achievement-gap-schools-schoolmatters.pdf"">Standard and Poor's School Evaluation Services</A> as having reduced the achievement gap between its students who are economically disadvantaged and those who are not.",1,0,0,2006-11-21T15:44:38,1.0,0.125,0.128,0.02,0.64,0.039,0.33899999999999997,0.5379999999999999,0.005,0.20199999999999999,0.243,0.09300000000000001
25Q079,Anonymous,queens,Elementary,1052,"Principal Joel Schuckman said, ""parent involvement is very strong in our school. Not many show up for PTA meetings, but when it comes to a fundraiser or donating things, it is unbelievable. If you ask them to bring in a ream of paper, some will donate an entire case.""",1,0,0,2006-06-19T16:24:07,1.0,0.125,0.128,0.02,0.64,0.039,0.33899999999999997,0.5379999999999999,0.005,0.20199999999999999,0.243,0.09300000000000001
25Q107,Angela Anastasio,queens,Elementary,870,"I went when Mr.Libowitz was the principal

",0,0,0,2012-05-19T22:55:58,0.75,0.257,0.156,0.07,0.762,0.079,0.531,0.5429999999999999,0.017,0.32899999999999996,0.102,0.126
25Q107,ISABEL WANG,queens,Elementary,870,P.S107 IS A AMAZING PLACE TO GO!,2,0,0,2011-04-05T01:18:17,0.75,0.257,0.156,0.07,0.762,0.079,0.531,0.5429999999999999,0.017,0.32899999999999996,0.102,0.126
25Q107,ISABEL WANG,queens,Elementary,870,DID YOU GO THERE BEFORE?,0,0,1,2011-04-05T01:25:33,0.75,0.257,0.156,0.07,0.762,0.079,0.531,0.5429999999999999,0.017,0.32899999999999996,0.102,0.126
25Q107,angela anastasio,queens,Elementary,870,I went there in the 80s it was awesome,0,0,2,2012-05-19T22:50:40,0.75,0.257,0.156,0.07,0.762,0.079,0.531,0.5429999999999999,0.017,0.32899999999999996,0.102,0.126
25Q107,newslink,queens,Elementary,870,"PS 107 prides itself on its forward-thinking programs and the strong collaboration between teachers and administrators.  Watch the video: <a href=""http://www.edwize.org/celebrating-public-schools-ps-107?utm_source=feedburner&utm_medium=feed&utm_campaign=Feed:+edwize+%28EdWize%29"">Celebrating Public Schools: PS 107</a>.",0,0,0,2011-01-14T20:05:45,0.75,0.257,0.156,0.07,0.762,0.079,0.531,0.5429999999999999,0.017,0.32899999999999996,0.102,0.126
25Q107,ANONYMOUS,queens,Elementary,870,"PS 107 is a nice school, however the PTA takes advantage of you. Once you say you will help they are the biggest thorn in your thigh.",0,0,0,2010-12-10T02:18:56,0.75,0.257,0.156,0.07,0.762,0.079,0.531,0.5429999999999999,0.017,0.32899999999999996,0.102,0.126
25Q107,student,queens,Elementary,870,"<p>""I went  to PS. 107 about eleven years ago. Dr. Phair was still principal at the time and I had finished 5th grade before moving out of the district. At the time, I had greatly admired the music and arts program at 107. ""Music in the Air"" was something we looked forward to as students. What I rememeber best from 107 was that the students were not only taught great academic programs, such as the Book of the Month, but the students were also encouraged by the faculty to understand culture and the society that we live in. We were taught different cultures that embody America. I had great teachers who helped me understand my topics. I had teachers who would come in weekly to teach the students Art, Music and general knowledge. As a current college student, I know that my foundation from 107 has helped me understand and learn better. My years in 107 will always be remembered. All I know is that I will always be thankful for my elementary years at PS 107.""</p>",0,0,0,2009-03-09T23:30:49,0.75,0.257,0.156,0.07,0.762,0.079,0.531,0.5429999999999999,0.017,0.32899999999999996,0.102,0.126
25Q107,ISABEL WANG,queens,Elementary,870,DO YOU LIKE P.S107?,0,0,1,2011-04-05T01:26:50,0.75,0.257,0.156,0.07,0.762,0.079,0.531,0.5429999999999999,0.017,0.32899999999999996,0.102,0.126
25Q107,Anonymous,queens,Elementary,870,"The parent coordinator said she responds to all parent inquiries within one day and called the low level of participation among immigrant families ""a challenge we're going to work on.""",0,0,0,2006-12-19T19:25:07,0.75,0.257,0.156,0.07,0.762,0.079,0.531,0.5429999999999999,0.017,0.32899999999999996,0.102,0.126
25Q107,lucila,queens,Elementary,870,"""The staff and administration as well as the parents work great together,"" writes parent Jane Reiff. ""The mix of students is incredible and to see the children from the classes helping and cheering on the handicapped children is amazing to see. PS 107 is a huge family. Music, chorus, science, computer, library, gym, basketball, cheerleading and family events are a normal part of this school and it all runs smoothly.""",0,0,0,2005-06-29T15:07:33,0.75,0.257,0.156,0.07,0.762,0.079,0.531,0.5429999999999999,0.017,0.32899999999999996,0.102,0.126
25Q107,Anonymous,queens,Elementary,870,"A parent writes: ""Although 107 is large it is like family. Not only do they have a great special ed program but the affiliation with the arts has made them superb. The number of students who are accepted to take the hunter exam increased this year which is a testament to the teaching. The IGC classes offer an opportunity for these children to get into SP classes in Junior High and the 4,5 and 6 grade IGC work together on a huge project which culminates into a wonderful extravaganza."" She adds: ""Every class performs in a play and in Music in the Air and they have a basketball team (one of the few in the district), cheerleading, dance troupe and peer mediation as well as a student government body, where they learn about the election process. Don't let the size fool you.""",0,0,0,2004-11-01T21:39:30,0.75,0.257,0.156,0.07,0.762,0.079,0.531,0.5429999999999999,0.017,0.32899999999999996,0.102,0.126
25Q107,Anonymous,queens,Elementary,870,"<P>""The teachers have a really big heart that is able to reunite the school as one through the performing arts program,"" writes the father of three boys, each in a different program at the school.</P>",0,0,0,2004-06-22T21:23:56,0.75,0.257,0.156,0.07,0.762,0.079,0.531,0.5429999999999999,0.017,0.32899999999999996,0.102,0.126
25Q120,Jenny Elguera,queens,Elementary,922,I have tried repeatedly to call the number on the school's website to ask some questions and  there has not been anyone answering the phone.  What if there is an emergency?????????,0,0,0,2017-10-20T15:48:39,0.75,0.408,0.139,0.040999999999999995,0.564,0.024,0.716,0.831,0.004,0.14800000000000002,0.01,0.092
25Q120,newslink,queens,Elementary,922,"PS 120 students were treated to a free carnival after some children were barred from a first carnival because they lacked money for tickets. Read more <a href=""http://nypost.com/2015/06/28/kids-get-free-carnival-after-being-banned-from-paid-event/"">here.</a>",0,0,0,2015-06-29T21:57:11,0.75,0.408,0.139,0.040999999999999995,0.564,0.024,0.716,0.831,0.004,0.14800000000000002,0.01,0.092
25Q120,Derek Lee,queens,Elementary,922,the dj was our computer teacher,0,0,1,2017-04-26T00:28:07,0.75,0.408,0.139,0.040999999999999995,0.564,0.024,0.716,0.831,0.004,0.14800000000000002,0.01,0.092
25Q120,Insideschools,queens,Elementary,922,"The principal of PS 120 has ignored offers to host a free carnival for poor students who were left out of the school's regular carnival because their parents were unable to pay the $10 fee. Read more <a href=""http://nypost.com/2015/05/31/principal-ignores-offers-to-host-free-carnival-for-poor-kids/"">here.</a>",0,0,0,2015-06-01T22:07:09,0.75,0.408,0.139,0.040999999999999995,0.564,0.024,0.716,0.831,0.004,0.14800000000000002,0.01,0.092
25Q120,NYC Parent,queens,Elementary,922,"I cannot believe this was allowed to happen. Shame on the principal, shame on the PA and shame on the teachers. Keeping a group of kids away from their peers because their parents didn't pay a fee is shameful. Disgusting.",0,0,0,2015-05-29T18:34:15,0.75,0.408,0.139,0.040999999999999995,0.564,0.024,0.716,0.831,0.004,0.14800000000000002,0.01,0.092
25Q120,Anonymous Also,queens,Elementary,922,"I just read on another site that the principal denied lunch and milk, although the school had plenty,  to children's whose balance had fallen below the required amount.  Is this true?  If so, it wouldn't surprise me from a principal who doesn't understand the concept of compassion.  Ms. Monroe - please step down.  Take some time to think about your priorities.  Then find another profession.",0,0,0,2015-05-28T02:27:03,0.75,0.408,0.139,0.040999999999999995,0.564,0.024,0.716,0.831,0.004,0.14800000000000002,0.01,0.092
25Q120,Anonymous Also,queens,Elementary,922,"I must repeat these words - uncaring, unkind and unfit to be a principal.",0,0,0,2015-05-28T01:28:19,0.75,0.408,0.139,0.040999999999999995,0.564,0.024,0.716,0.831,0.004,0.14800000000000002,0.01,0.092
25Q120,TDonkor,queens,Elementary,922,Shame on you Principal Joan Monroe. Excluding children from the carnival because their parents can't afford it.  You are the talk of the neighborhood and everyone is disgusted. You are what is wrong with teaching and your children deserve better.,0,0,0,2015-05-27T12:10:21,0.75,0.408,0.139,0.040999999999999995,0.564,0.024,0.716,0.831,0.004,0.14800000000000002,0.01,0.092
25Q120,Anonymous Also,queens,Elementary,922,"A  principal, who would exclude children from a school event during school hour because their parents couldn't afford to pay, is uncaring, unkind and unfit to be a principal. I called the school, the Assemblywoman, the District Council and several others.  I am thankful that my children attend a different public school, where our principal is kind and caring to all of the children.  We don't have expensive street fairs.  We have little ""carnivals"" in our cafeteria where ALL of the children can toss balls into cups and ""bowl"" down paper pillars with balls and do other fun activities.  It doesn't cost much, but the children love it.   What happened at PS 120 is a terrible example for all the children, those who attended the fair and those who could not.   What bad judgment!",0,0,0,2015-05-27T00:31:52,0.75,0.408,0.139,0.040999999999999995,0.564,0.024,0.716,0.831,0.004,0.14800000000000002,0.01,0.092
25Q120,Lisa Baynes Adkins,queens,Elementary,922,I really hope and pray that others like myself makes a call not just to the school but to the School Board also. This Principal was 110% wrong and really should have her job taken away. She needs to learn how it feels to live with a budget. What she done to these kids was uncalled for. She should set an example and be the solution and not the problem......http://nypost.com/2015/05/24/no-pay-no-play-kids-who-cant-pay-10-fee-banned-from-school-carnival/,0,0,0,2015-05-26T23:09:51,0.75,0.408,0.139,0.040999999999999995,0.564,0.024,0.716,0.831,0.004,0.14800000000000002,0.01,0.092
