dbn,username,borough,grade_level,enrollment,comment,likes,dislikes,replies,post_date,fam_comm_ties,pct_ell,pct_disabilities,pct_self_contained,economic_need_index,pct_temp_housing,pct_hra_eligible,pct_asian,pct_black,pct_hispanic,pct_white,pct_chronic_absent
24Q091,atheist queen,queens,Elementary,658,"Please do not send your child here. As a student who graduated three years ago, I can say that you will regret it. I am someone who struggles with both social anxiety and OCD and I constantly felt trapped. There is no support system and it is easy to get bullied. The school is filled with English language learners which will most likely hold your child back. I was always top of my class no matter what because everyone was just THAT stupid. The teachers do not care about you, period. I have so many bad experiences I remember it would be impossible to list all of them. There isn't any kind of sufficient extra curricular at all and I was afraid of being physically assaulted by teachers. Whatever you do, don't let your child attend.",0,0,0,2018-08-28T03:46:26,0.75,0.12300000000000001,0.201,0.076,0.9059999999999999,0.046,0.483,0.028999999999999998,0.023,0.509,0.433,0.287
24Q091,newslink,queens,Elementary,658,"PS 91 received a visit from Chancellor Carmen Fariña who was promoting a new citywide literacy initiative, NYC Reads 365. Read more <a href=""http://www.qchron.com/editions/queenswide/ps-fari-a-help-promote-literacy/article_63dd736d-e7be-507c-974c-0c8eee37e1f0.html"">here</a>.",0,0,0,2015-11-30T18:42:35,0.75,0.12300000000000001,0.201,0.076,0.9059999999999999,0.046,0.483,0.028999999999999998,0.023,0.509,0.433,0.287
24Q091,Shammeek,queens,Elementary,658,"I am a parent of a G&amp;T student int eh 5th grade, I love how the teacher really gives my child the homeowrk and knowledge they need. I love this school",0,0,0,2010-11-04T01:03:41,0.75,0.12300000000000001,0.201,0.076,0.9059999999999999,0.046,0.483,0.028999999999999998,0.023,0.509,0.433,0.287
24Q091,AandAmom,queens,Elementary,658,"<p>""The new uniform policy is truly a blessing.  Parents do have the option to opt out if they wish.  The Parents Association will also provide unifroms to those in need.  The school has improved in their extra curricular activities.  Last year, the school's first ""Math Night"" was a huge success.  The kids have dances on a Friday night during the winter, and movie nights as well.    The one thing that PS 91 needs to improve on is Phys Ed.  Children get gym only once a week.  Lots of teachers opt to take their class to the local park on nice days.  It's not enough.  Gym class should be daily, just like math or english.""</p>",0,0,0,2008-09-24T11:54:06,0.75,0.12300000000000001,0.201,0.076,0.9059999999999999,0.046,0.483,0.028999999999999998,0.023,0.509,0.433,0.287
24Q091,workingmom,queens,Elementary,658,"<p>""My son just started kindergarten.  I think, not sur but i think its the first year they are to wear uniforms!  I LOVE IT! its great! and the kids look adorable.  I LOVE THE UNIFORMS!""</p>",0,0,0,2008-09-04T17:36:42,0.75,0.12300000000000001,0.201,0.076,0.9059999999999999,0.046,0.483,0.028999999999999998,0.023,0.509,0.433,0.287
24Q091,Anonymous,queens,Elementary,658,"<P>A parent writes to tell us that PS 91 now has a gifted and talented program which begins in 1st grade. PS 91 is the third elementary school in the district to have a G&amp;T program, joining PS 153 and PS 16, this mother&nbsp;noted. After 25 years of the gifted program beginning in kindergarten, it now begins in 1st grade, she said. </P>",0,0,0,2006-09-15T15:28:12,0.75,0.12300000000000001,0.201,0.076,0.9059999999999999,0.046,0.483,0.028999999999999998,0.023,0.509,0.433,0.287
24Q091,Anonymous,queens,Elementary,658,"A parent writes to tell us that the ""much loved and respected"" parent coordinator Enrique Vasquez ""has passed away. The Parent Coordinator is now Veronica Feliciano."" &nbsp;",0,0,0,2006-03-14T15:25:59,0.75,0.12300000000000001,0.201,0.076,0.9059999999999999,0.046,0.483,0.028999999999999998,0.023,0.509,0.433,0.287
24Q093,"class 815 student, of 2017",queens,Middle,1124,"holy heck I'm 13 right now and i graduated in 2017 and i just found out that my favorite teacher from 8th grade, mr. cognato had been sending nudes and inappropriate videos of himself to one of his underage former students over this summer and convinced her to start doing the same. i can't believe he'd do such a goof. he was honestly my favorite teacher last year and he motivated me to work harder on my art. i know that the acts of one teacher shouldn't judge the entire school but theres no place else for me to vent about this and i just generally upset about the whole ordeal. he was married and i could tell he was a huge inspiration on his students. i hope he's ashamed of what he's done cause he's just lost 15 years of his life on a prison sentence. absolutely disgusting i hope he can't stand himself . and the fact that he's acted on such emotions can only mean he's felt similar ways to previous students considering he's been teaching at this school since 2001. i feel so bad for the poor girl who was pressured into such a situation by such a filthy man. you were supposed to teach us to help us grow and you taught us about life and so many more things than just math and you just threw it all out once you ruined this poor girls life with such disgusting videos of yourself. how could you do that to her. absolutely disgusting",0,0,0,2017-10-08T05:35:22,0.5,0.136,0.218,0.061,0.6759999999999999,0.125,0.652,0.076,0.026000000000000002,0.7190000000000001,0.17300000000000001,0.16399999999999998
24Q093,Insideschools,queens,Middle,1124,"IS 93Q students complete inaugural puppy rescue/leadership program  <a href=""http://www.qchron.com/editions/central/is-q-students-complete-a-special-puppy-rescue-program-called/article_862b13f4-4f7c-11e7-abb4-6fefcf3bfdd5.html"">as Queens Chronicle Reports</a>.",0,0,0,2017-07-27T15:05:06,0.5,0.136,0.218,0.061,0.6759999999999999,0.125,0.652,0.076,0.026000000000000002,0.7190000000000001,0.17300000000000001,0.16399999999999998
24Q093,Person,queens,Middle,1124,"I am a senior at this school and i truly like it here. i am in an SP class and taking regents for my freshman year. This is a great middle school but the problem is the obnoxious kids that pick fights for the dumbest reasons. However the teachers here like Mr.Brett is a professional, respectful and intelligent teacher that helps me a lot and prepares me for the challenges in high school. I really do recommend this school but be aware of the students.",0,0,0,2016-11-27T02:46:57,0.5,0.136,0.218,0.061,0.6759999999999999,0.125,0.652,0.076,0.026000000000000002,0.7190000000000001,0.17300000000000001,0.16399999999999998
24Q093,Newslink,queens,Middle,1124,"In honor of the building's 100th anniversary, the graduating class of 2016 buried a time capsule to be opened in 50 years. Read more <a href=""http://qns.com/story/2016/06/28/graduating-class-at-ridgewood-middle-school-leaves-time-capsule-for-future-students/"">here</a>.",0,0,0,2016-07-13T20:28:18,0.5,0.136,0.218,0.061,0.6759999999999999,0.125,0.652,0.076,0.026000000000000002,0.7190000000000001,0.17300000000000001,0.16399999999999998
24Q093,Jim,queens,Middle,1124,"I feel compelled to respond to the last comment.  I understand the adolescent mindset.  I have been teaching at this school for a long time.  As you know, adolescents think that the world revolves around them.  This is not their fault, but apart of the brain development process. 

 This particular student was bitter because his perception.  Perception is not always reality.  For instance, he claimed he was being picked on and nothing was done about it, yet he praised the Dean, Ms. Valentin, using the adjective “amazing”.  I know all of his teachers and they would have not tolerated this name calling.  Ms. Valentin would have dealt with any bullies.  We try our best to be a bully free zone.  Unfortunately, this student assumed that teachers knew what was going on.  This has to do with the adolescent mind set (the world revolves around them).  Teachers have hundreds of students and try their best to deal with every situation that arises while engaging students in interesting lessons.  

As for his comment about “Horrible” teachers, he seems to focus on the negative.  There are no reasons mentioned as to why they were horrible.  I know many of his teachers and they all talked highly about him.  His contributions to discussions was a major reason why.  He asked very good high level question and was always engaged. 

As for the assistant principle, she was stern, which is often looked down upon these days.  I will stick up for her in that she always maintained order while giving breathing space to students to allow for creativity.  The principle was busy planning activities, teaching classes, and working with teachers to improve their skill set.  

The after-school program happens to be affiliated with the school. They do a great job in engaging students in the arts, sports, and video games. 

It is sad that this experience has led him to want to tarnish the reputation of the school. I only hope the best for this student and that he realizes the good as well as the bad.  When you read a negative comment by a former student or former parent, think objectively and realize that their perception isn’t always reality.",0,0,0,2015-11-11T03:15:01,0.5,0.136,0.218,0.061,0.6759999999999999,0.125,0.652,0.076,0.026000000000000002,0.7190000000000001,0.17300000000000001,0.16399999999999998
24Q093,Senior,queens,Middle,1124,I just graduated from this school ; and I transferred here from 89x in The Bronx ; and I WISH I DIDNT HAVE TO ! This school is soo bad 😂 being gay is already hard enough ; going to this school just made it even worst ; at my old school no one bullied me ; but at this school it was always you're a fag or you're gay this and all that and it wasn't once in a while No ; it was everyday and the teachers didn't do anything until I was about to fight the kids that said this stuff to me ; some teacher are great but more are HORRIBLE ; The Assistant Principle of My Grade o would always just yell at kids ; and didn't really like the kids ; I mean it didn't bother me ; I wouldn't go to her when I had problems ; she did correct some of my problems but with most of the correction being from my Dean Ms.Valentine ; who was amazing ; literally one of thee only things I didn't hate about this school . The year I went to this school it just started getting school teams ; I was on the Cheerleading Team that was with the school and the Step team that was with an after school program ; any team that the school had was most likely just with the after school program only ; and had nothing to do with the school ; I would never recommend anyone to send their child to this school ; the kids are nasty ; the staff nastier ; and the principle ; I can't even say because I barely knew him ; he didn't try to connect with the students at all ; thee only reason he knew of my presence was because I tried out for the cheerleading team and made it ; that's it ; wouldn't recommend this school to anyone 💯,0,0,0,2015-08-17T20:44:48,0.5,0.136,0.218,0.061,0.6759999999999999,0.125,0.652,0.076,0.026000000000000002,0.7190000000000001,0.17300000000000001,0.16399999999999998
24Q093,Senior2013-2014,queens,Middle,1124,Hate the racisms and favorites chosen. Sexually harassment. People kissing in the staircases. People hugging in the middle of the hallway. Crowdedness. Lateness. Unhelpful teachers. Rudeness. Three years of academy shirts and not even get to change color. Love SPIRT WEEK!!! The only thing good about the school besides lots of friends.,5,0,0,2013-09-29T22:19:53,0.5,0.136,0.218,0.061,0.6759999999999999,0.125,0.652,0.076,0.026000000000000002,0.7190000000000001,0.17300000000000001,0.16399999999999998
24Q093,TheTruth,queens,Middle,1124,"The only thing their curriculum specialist, George Foley, knows about curriculum is that he doesn't know how to spell it.",0,0,0,2012-05-28T15:14:07,0.5,0.136,0.218,0.061,0.6759999999999999,0.125,0.652,0.076,0.026000000000000002,0.7190000000000001,0.17300000000000001,0.16399999999999998
24Q093,7th grader,queens,Middle,1124,I am currently in 7th grade. I am in a SP class and a Dual language class. All of my teachers do good job on teaching. My math teacher does over explain things which makes math boring. Science is really fun. ELA is okay. I love Spanish most of all. Mr.Lopez is the best teacher you could ever have! The stair cases are really crowded and will arrive late once in awhile because of it. We have a uniform. Only shirts. There are fights often. The school is very crowded and separated the 6th graders for safety reason. FRESHMAN FRIDAY! it just awful people are so rude. This is overall a good school. :),12,0,0,2012-03-16T00:28:02,0.5,0.136,0.218,0.061,0.6759999999999999,0.125,0.652,0.076,0.026000000000000002,0.7190000000000001,0.17300000000000001,0.16399999999999998
24Q093,93 STAY AWAY,queens,Middle,1124,"I taught at this school for years. The reason there is a high turnover rate is that the teachers are treated like dirt. Former principal George Foley couldn't teach his way out of a wet paper bag. He ruled by intimidation. His successor, Ed Santos, has almost no knowledge of educational theory or curriculum. He simply carries on in Foley's clown shoe footsteps, bullying teachers and making sure that there are no veteran experienced teachers in the school. That's what leads to the massive discipline problems this school has. Cathy Fratangelo, another AP, is a former gym teacher who rules the ELA department, which is why the schools scores are a disaster. If you can get your children into another school, do it. You'll thank me.",4,0,0,2011-07-07T20:48:18,0.5,0.136,0.218,0.061,0.6759999999999999,0.125,0.652,0.076,0.026000000000000002,0.7190000000000001,0.17300000000000001,0.16399999999999998
24Q093,school staff,queens,Middle,1124,<p>I worked in this school briefly and I could tell you that Mr. Santos tries really hard to help students change but he needs to be tougher on them. when i worked there it wasn't as bad as people make it seem to be but there are problems with fights that need to be fixed.</p>,1,0,0,2010-08-09T19:35:10,0.5,0.136,0.218,0.061,0.6759999999999999,0.125,0.652,0.076,0.026000000000000002,0.7190000000000001,0.17300000000000001,0.16399999999999998
24Q093,parent,queens,Middle,1124,<p>Mr Santos who is the current principal of the school is trying to keep a good image of himself and the school. But the truth is the school has serious problems with kids being bullied by other kids and no one wants to take on the responsibility of what's happening. I am probably one of the parents that is actually aware of the bullying because my child lets me know. My daughter has been a victim of the bulliness. I want to shed light on this matter because the times I've been there and asked to have a parent meeting Mr. Santos has refused to conduct such meeting. I also want to point out that there has been serious matters where I actually had to call the police to the school. If any has had any issues with this school I advise you to contact 311 and file a complaint and get to know your rights by going to the following website www.advocateforchildren.org</p>,3,0,0,2010-04-12T18:28:12,0.5,0.136,0.218,0.061,0.6759999999999999,0.125,0.652,0.076,0.026000000000000002,0.7190000000000001,0.17300000000000001,0.16399999999999998
24Q093,TeamMeep,queens,Middle,1124,Does the school have a Dean to help with these issues in such a huge school?,0,0,1,2014-07-04T01:15:31,0.5,0.136,0.218,0.061,0.6759999999999999,0.125,0.652,0.076,0.026000000000000002,0.7190000000000001,0.17300000000000001,0.16399999999999998
24Q093,Colonis8enough,queens,Middle,1124,"Yes,you're 100% correct that Mr.Santos don't takes his responsibility to serious,I'm having a issued with him & so call  unprofessional teachers( Broad of Education needs to investigate whats going on in IS93................",3,0,1,2011-02-11T00:55:54,0.5,0.136,0.218,0.061,0.6759999999999999,0.125,0.652,0.076,0.026000000000000002,0.7190000000000001,0.17300000000000001,0.16399999999999998
24Q093,student,queens,Middle,1124,"<p>""I love this school so much! It's by far the best school i've attended to. I made lots of friends. The teachers there are very friendly. They dont just prepare u for your next grade or high school, but they prepare you for college too. I will be extremly sad to leave this school in June (Senior). I highly reccomend this school""</p>",0,0,0,2008-11-20T00:36:55,0.5,0.136,0.218,0.061,0.6759999999999999,0.125,0.652,0.076,0.026000000000000002,0.7190000000000001,0.17300000000000001,0.16399999999999998
24Q093,janbarksdale,queens,Middle,1124,"Student Kayde writes that ""if you're a good kid, you won't really have problems at this school, but if you're a troublemaker, then it won't be hard for you to find problems."" Kayde also notes that teachers, especially Mr. Levine, ""do a good job teaching.""",0,0,0,2007-04-10T14:32:27,0.5,0.136,0.218,0.061,0.6759999999999999,0.125,0.652,0.076,0.026000000000000002,0.7190000000000001,0.17300000000000001,0.16399999999999998
24Q093,Coat,queens,Middle,1124,"Student Debbie praises the numerous ""benefits"" students receive, including laptop computers that they keep for three years and ""make learning fun"" and a variety of extracurricular activities such as choir, digital photography, and gardening.",0,0,0,2006-06-21T15:21:02,0.5,0.136,0.218,0.061,0.6759999999999999,0.125,0.652,0.076,0.026000000000000002,0.7190000000000001,0.17300000000000001,0.16399999999999998
24Q093,montrose,queens,Middle,1124,"""The teachers here are great and I feel that all of them have helped me very much in many ways,"" writes student Lia.",0,0,0,2006-04-04T18:52:39,0.5,0.136,0.218,0.061,0.6759999999999999,0.125,0.652,0.076,0.026000000000000002,0.7190000000000001,0.17300000000000001,0.16399999999999998
24Q093,Anonymous,queens,Middle,1124,"The first student clarifies, ""Boys and girls not having gym together is not the problem I had. The problem some girls have is not being able to play sports they love (like basketball) because to I.S.93, basketball is a 'boy's sport' and yoga or badminton are 'girl's sports.' English teachers at I.S. 93 assign persuasive essays and debates on this topic all the time in which the gender-specific stereotypes are called into question and in these debates students agree that that girls should be allowed to play a 'boy's sport' with other girls.""  
<P>In response to the debate about gym classes, a student, Magda, writes, ""I think girls and boys playing some sports together and others separately makes IS93 a great school because in other schools it's not possible to do that. I've been at 93 almost 2 years now and no one in my class hates this method of gym!""  </P>",0,0,0,2005-11-21T16:04:30,0.5,0.136,0.218,0.061,0.6759999999999999,0.125,0.652,0.076,0.026000000000000002,0.7190000000000001,0.17300000000000001,0.16399999999999998
24Q093,Anonymous,queens,Middle,1124,"<P>""Boys and girls gyms are separate, and boys play basketball and football, while girls do yoga and kickball. It's very unfair, and has been like this for years,"" writes a student.  </P>
<P>In response to the above comment, Principal George Foley writes: ""This is not entirely accurate. We do have some sports that integrate boys and girls, such as volleyball. Girls get a chance to participate in badminton and dance which boys are not willing to participate in. Some of the boy's activities get very competitive so having girls play soccer separately seems to be good for everyone. Two graduates of 93 have gone on to become captains of the US National Soccer Team. One scored a goal against Argentina in the Olympics.""  </P>",0,0,0,2005-11-01T18:39:56,0.5,0.136,0.218,0.061,0.6759999999999999,0.125,0.652,0.076,0.026000000000000002,0.7190000000000001,0.17300000000000001,0.16399999999999998
24Q093,tatkid,queens,Middle,1124,"""I have seen firsthand the huge improvements that have taken place,"" writes Paul Perskin, a 4th year teacher at the school. ""The faculty is dedicated to advancing the knowledge of the students as well as preparing them for any future endeavors.""",0,0,0,2005-10-06T15:08:51,0.5,0.136,0.218,0.061,0.6759999999999999,0.125,0.652,0.076,0.026000000000000002,0.7190000000000001,0.17300000000000001,0.16399999999999998
24Q093,RACHELP,queens,Middle,1124,"""This school is the best! Even though I just started IS 93 made me feel like I was always here,"" writes Maria, a student. ""There is digital photography. I am in the SP class, which is for more advanced students and I've got to say all the work at first is a bit too much but at the end it all pays off. You can choose between Spanish or Italian. This school is very strict in a very professional way.""",0,0,0,2005-09-09T18:01:32,0.5,0.136,0.218,0.061,0.6759999999999999,0.125,0.652,0.076,0.026000000000000002,0.7190000000000001,0.17300000000000001,0.16399999999999998
24Q093,Anmoted7,queens,Middle,1124,"Danny, a student, writes: ""8th grade was the best darn year in my entire life !!! I am currently a junior in college [and] to this day, even six years [after] leaving IS93, I preach to my friends how this school was THE BEST school in my entire life. I still go visit there when I can.""",1,0,0,2005-05-19T19:29:24,0.5,0.136,0.218,0.061,0.6759999999999999,0.125,0.652,0.076,0.026000000000000002,0.7190000000000001,0.17300000000000001,0.16399999999999998
24Q093,lisa03,queens,Middle,1124,"Samuel Szetela, who used to teach at the school, writes: ""IS 93 has made great strides in recent years. Though I left at the end of the 2004 school year to return upstate, I am very proud that I was a part of the faculty there. All the recent instructional changes, from the workshop model to academies to looping, have made IS 93 a model school. I wish my friends and colleagues the best of luck and it is with great pleasure that I give my vote of confidence to one of the most dedicated schools in New York City.""",1,0,0,2005-05-05T17:08:37,0.5,0.136,0.218,0.061,0.6759999999999999,0.125,0.652,0.076,0.026000000000000002,0.7190000000000001,0.17300000000000001,0.16399999999999998
24Q093,kgates,queens,Middle,1124,"Bonnie, a 7th-grader at the school, writes: ""I love the school and the teachers are very nice.""",0,0,0,2005-03-01T19:23:37,0.5,0.136,0.218,0.061,0.6759999999999999,0.125,0.652,0.076,0.026000000000000002,0.7190000000000001,0.17300000000000001,0.16399999999999998
24Q093,fossils,queens,Middle,1124,"Elizabeth, a student, writes: ""IS 93 is really a great school. It's a bit overcrowded and there are occasional fights, but it's not that bad. One of my friends came all the way from Long Island City just to go to school here, because she heard about the great programs we have here. Most of the teachers are also really nice. I'm a senior right now, but I'm going to be pretty sad when I have to leave for high school.""",1,0,0,2005-02-28T22:05:00,0.5,0.136,0.218,0.061,0.6759999999999999,0.125,0.652,0.076,0.026000000000000002,0.7190000000000001,0.17300000000000001,0.16399999999999998
24Q093,rae eisdorfer,queens,Middle,1124,"Katie, a student, writes: ""I love this school! It is great and the classes are fun. The teachers are nice, but the food could be better.""",0,0,0,2005-02-09T18:04:36,0.5,0.136,0.218,0.061,0.6759999999999999,0.125,0.652,0.076,0.026000000000000002,0.7190000000000001,0.17300000000000001,0.16399999999999998
24Q093,Anonymous,queens,Middle,1124,"A 7th-grader at the school writes: ""I love this school. ... This is the best school I been to yet.""",0,0,0,2005-01-06T16:09:51,0.5,0.136,0.218,0.061,0.6759999999999999,0.125,0.652,0.076,0.026000000000000002,0.7190000000000001,0.17300000000000001,0.16399999999999998
24Q093,RJACK,queens,Middle,1124,"Fatima, a student, writes: ""[IS] 93 is the best school out there. I think you people should visit the school because the teachers there are so helpful and teach you a lot. They also know how to prepare you very well for high school (since I'm a senior).""",0,0,0,2004-12-16T20:21:52,0.5,0.136,0.218,0.061,0.6759999999999999,0.125,0.652,0.076,0.026000000000000002,0.7190000000000001,0.17300000000000001,0.16399999999999998
24Q093,Anonymous,queens,Middle,1124,"An immigrant parent from Eastern Europe said that the school ""is not so bad"" but that there are sometimes fights between kids from different ethnic backgrounds.",0,0,0,2004-11-23T21:11:09,0.5,0.136,0.218,0.061,0.6759999999999999,0.125,0.652,0.076,0.026000000000000002,0.7190000000000001,0.17300000000000001,0.16399999999999998
24Q093,pablodulce,queens,Middle,1124,"Di I., a student, describes her visit to the school: ""When I walked inside I was so excited that I wanted to go to school on that day. I heard music I heard a song from the movie Greece and it was one of my favorite movies, and in a glass box I saw all of the honor students! And let me tell you something! It was so amazing just being in the school I dreamed to be in before! I was registering and already I wanted to get my book bag and start school, and that is the truth!""",2,0,0,2004-08-25T15:48:57,0.5,0.136,0.218,0.061,0.6759999999999999,0.125,0.652,0.076,0.026000000000000002,0.7190000000000001,0.17300000000000001,0.16399999999999998
24Q102,P.A.,queens,K-8,1263,"All parents, guardians, and families of PS/IS 102Q Bayview students, please stay connected with the Parent Association. All parents and legal guardians are automatically members in the Parent Association! Check our website, Instagram, and sign up for instant communication, to stay informed about all our activities and events for the school year. We welcome your questions, feedback and suggestions!

Parent Association of PS/IS 102Q
www.Q102pa.org
@Q102pa",0,0,0,2019-08-26T20:22:49,0.75,0.13699999999999998,0.146,0.048,0.968,0.086,0.597,0.608,0.032,0.317,0.028999999999999998,0.105
