dbn,username,borough,grade_level,enrollment,comment,likes,dislikes,replies,post_date,fam_comm_ties,pct_ell,pct_disabilities,pct_self_contained,economic_need_index,pct_temp_housing,pct_hra_eligible,pct_asian,pct_black,pct_hispanic,pct_white,pct_chronic_absent
24Q153,newslink,queens,Elementary,1076,"A 7-year-old special needs student was handcuffed and taken to the hospital for throwing a tantrum in class.  Read the article in the Daily News: <a href=""http://www.nydailynews.com/ny_local/education/2011/04/21/2011-04-21_mom_says_she_was_on_way_to_pick_up_son_but_she_got_there_too_late_they_gotta_be_.html"">Special-ed student Joseph Anderson, 7, handcuffed by cops at Queens school after Easter egg tantrum</a>.",0,0,0,2011-04-22T16:13:14,1.0,0.10300000000000001,0.19,0.049,0.669,0.040999999999999995,0.467,0.105,0.008,0.456,0.414,0.172
24Q153,Eckkoqwere,queens,Elementary,1076,"""I liked how you had the same friends for years,"" writes recent graduate Alicja. ""The Beacon Program got me into a good habit of always doing your homework, and I also learned at a fast pace.""",0,0,0,2007-06-06T16:53:08,1.0,0.10300000000000001,0.19,0.049,0.669,0.040999999999999995,0.467,0.105,0.008,0.456,0.414,0.172
24Q153,Anonymous,queens,Elementary,1076,"A special needs student who is one of nine PS 153 kids participating in a weekly dance program at Ballet Tech, a dance school for 4th to 12th graders in Manhattan, was offered a transfer there and a scholarship. ""It's a great opportunity for him, but we're looking to see if Ballet Tech can match his IEP,"" Principal Susan Bauer told Insideschools, referring to the ""individualized education program"" prepared for any student identified as having special needs.",0,0,0,2007-04-30T16:27:50,1.0,0.10300000000000001,0.19,0.049,0.669,0.040999999999999995,0.467,0.105,0.008,0.456,0.414,0.172
24Q153,Anonymous,queens,Elementary,1076,"PS 153 was identified by <A href=""http://www.schoolmatters.com/pdf/achievement-gap/ny-achievement-gap-schools-schoolmatters.pdf"">Standard and Poor's School Evaluation Services</A> as having reduced the achievement gap between its students who are economically disadvantaged and those who are not.",0,0,0,2006-11-21T15:41:40,1.0,0.10300000000000001,0.19,0.049,0.669,0.040999999999999995,0.467,0.105,0.008,0.456,0.414,0.172
24Q153,Anonymous,queens,Elementary,1076,"The parent of a child in the gifted program says PS 153 is ""excellent,"" noting that in a recent year five sixth graders&nbsp;tested into the competitive&nbsp;Hunter College High School in Manhattan. However, this parents says, like many schools in District 24, PS 153 is ""overcrowded.""",0,0,0,2006-09-22T15:54:22,1.0,0.10300000000000001,0.19,0.049,0.669,0.040999999999999995,0.467,0.105,0.008,0.456,0.414,0.172
24Q153,Joha37,queens,Elementary,1076,"""I didn't realize how advanced the Beacon program was until I got to middle school, and found that I already knew most of the 6th grade curriculum!"" writes Mike Leykum, a 1999 graduate of the program.",0,0,0,2005-12-08T22:16:22,1.0,0.10300000000000001,0.19,0.049,0.669,0.040999999999999995,0.467,0.105,0.008,0.456,0.414,0.172
24Q153,maria Jaya-Vega,queens,Elementary,1076,"Leslie, a former student, writes: ""I graduated from PS 153 in 1999. I was in the Beacon program for gifted kids. Honestly, the six years I spent at PS 153 were some of the best years of my life. Having basically the same classmates year after year in the Beacon class, I grew very attached to my classmates. My classmates and many of their parents became my extended family. I still keep in touch with some of them today. The education I received from this school helped me greatly in middle school, and even now in high school.""",1,0,0,2005-01-24T20:43:37,1.0,0.10300000000000001,0.19,0.049,0.669,0.040999999999999995,0.467,0.105,0.008,0.456,0.414,0.172
24Q153,Anonymous,queens,Elementary,1076,"Kristen, a 6th-grader, writes: ""I love PS 153. All of the teachers are willing to help you and are always encouraging me to do better. ... This school holds so many warm memories and has been such a great place for me to go to since I was five years old. 153 has many great teachers and has a great principal and assistant principals that keep everything straight and orderly. They also have after school programs from P.A.L. such as basketball for boys and girls, golf for girls, and flag football for boys."" She adds: ""All the people there are caring and will always be there to answer your questions or comfort you in hard times. The teachers create such a bond with their students ... and I love it. I recall in 2nd grade when I asked my teacher to come over my house for a play-date."" Kristen concludes: ""Putting me into 153 is probably the best choice my parents could have made for me. 153 is not only a place that I can learn in but it is a place I can be myself and have fun and that is in my opinion, is what makes a terrific school.""",0,0,0,2004-12-29T19:28:48,1.0,0.10300000000000001,0.19,0.049,0.669,0.040999999999999995,0.467,0.105,0.008,0.456,0.414,0.172
24Q199,newslink,queens,Elementary,718,"As more and more schools are forced to convert dedicated art rooms to academic spaces because of overcrowding, some administrators such as Principal Anthony Inzerillo emphasize their importance. Read more <a href=""http://www.wnyc.org/story/how-important-art-room-anyway/"">here</a>.",0,0,0,2015-08-04T15:29:51,1.0,0.355,0.191,0.07,0.8420000000000001,0.10300000000000001,0.65,0.32,0.024,0.575,0.064,0.195
24Q199,Guest,queens,Elementary,718,"PS 199 school principal is excellent. He really runs the school so well. He is also very caring with kids. I am so lucky that my kid is in such school with great Principal. I salute you ""SIR"".",1,0,0,2014-11-13T21:28:34,1.0,0.355,0.191,0.07,0.8420000000000001,0.10300000000000001,0.65,0.32,0.024,0.575,0.064,0.195
24Q199,Guest,queens,Elementary,718,"Grading they are giving on the report seems not appropriate. lots of up and down. Honestly, my daughter is excellent in Art still she is not getting as worth to get. i also saw other students report who are  not at all good in art still they got outstanding grade. As as parent, it hurt alot if the teachers are not being honest with grade. I know there are difference in teacher for giving grade.",1,0,0,2014-11-13T21:19:56,1.0,0.355,0.191,0.07,0.8420000000000001,0.10300000000000001,0.65,0.32,0.024,0.575,0.064,0.195
24Q199,newslink,queens,Elementary,718,"The District 24 Community Education Council voted to transform PS 199 into a K-5 school with its 4th grade students remaining at the school for 5th grade. Read more <a href=""http://www.qchron.com/editions/western/school-rezoning-is-topic-at-district/article_c681907f-a3d8-5b76-a89f-f97ec7fec803.html"">here</a>.",1,0,0,2014-05-01T20:26:02,1.0,0.355,0.191,0.07,0.8420000000000001,0.10300000000000001,0.65,0.32,0.024,0.575,0.064,0.195
24Q199,Parent,queens,Elementary,718,"While this school is great for ESL students, it lacks in the arts and technology departments.  We do not feel welcome as parents.",1,0,0,2013-11-27T06:30:41,1.0,0.355,0.191,0.07,0.8420000000000001,0.10300000000000001,0.65,0.32,0.024,0.575,0.064,0.195
24Q199,Nycmayhemmc,queens,Elementary,718,"Mr. Inzerillo makes the school run very smoothly.,  He is always someone parents and students can count on.  He really cares about the kids and it is obvious to everyone.  I have 3 children.  2 are no longer at PS199 and 1 still is.  The 2 schools my children are in now don't come close to how good and respected my children were treated at 199.  It is a special place and I wish all my children could remain at 199.",1,0,0,2011-07-22T01:36:31,1.0,0.355,0.191,0.07,0.8420000000000001,0.10300000000000001,0.65,0.32,0.024,0.575,0.064,0.195
24Q199,parent,queens,Elementary,718,<p>My son graduated from ps 199 in june and i miss the school already.  The teachers care about the kids and you will always find the principal hanging out with the kids asking them how they are doing and what he can do to help him.  My son misses everyone at ps199.  He talks about ms. nancy and how she is always talking nice with the kids.</p>,3,0,0,2010-08-09T18:05:24,1.0,0.355,0.191,0.07,0.8420000000000001,0.10300000000000001,0.65,0.32,0.024,0.575,0.064,0.195
24Q199,glena119,queens,Elementary,718,"A parent writes: ""My child had [current Principal] Mr. Inzerillo as a 3rd-grade teacher three years ago. He came to work prepared each day (with a tie on) to teach my son. My son was a special education child and Mr. Inzerillo always involved my son when his past teachers could not get him to learn. He was able to score a 3 on the tests at the end of the year. I was so happy when I heard that Mr. Inzerillo became the principal. When Mr. Inzerillo left to go to another school the parents were very upset. The children were even more upset. He would help students from other classes even though their child was not in his class. What a difference Mr. Inzerillo is going to make at PS 199. We love him and know he will do the right thing by our children!""",3,0,0,2004-12-16T20:28:24,1.0,0.355,0.191,0.07,0.8420000000000001,0.10300000000000001,0.65,0.32,0.024,0.575,0.064,0.195
24Q229,Jose Dume,queens,Elementary,1385,I still remember when Mr.McKnalley (I don't quite remember how to spell his name) was the Principal in school. I fondly remember the wall with the solar system embedded in it.,0,0,0,2014-03-03T16:58:14,1.0,0.079,0.20800000000000002,0.08800000000000001,0.20199999999999999,0.06,0.505,0.369,0.022000000000000002,0.409,0.195,0.14800000000000002
24Q229,WoodsideMom,queens,Elementary,1385,"My youngest son is in the 6th grade at PS 229 this year and I will be sorry to leave the school in June. Great principal, great teachers, great atmosphere. A correction to the above review - the school hired a Phys Ed teacher a few years ago and he uses the combo gym/lunchroom for real gym classes. He teaches the kids all kinds of team sports - even lacrosse. Also, the 4th graders get 10 weeks of twice a week Ballroom Dancing lessons every winter (in addition to gym). ",0,0,0,2013-02-07T15:35:51,1.0,0.079,0.20800000000000002,0.08800000000000001,0.20199999999999999,0.06,0.505,0.369,0.022000000000000002,0.409,0.195,0.14800000000000002
24Q229,JustaParent2,queens,Elementary,1385,Hi! Both of my children might be going to PS 229 next year.  I would like to get some update information about this school before making my final decision.  Thank you.,0,0,0,2012-06-14T14:02:39,1.0,0.079,0.20800000000000002,0.08800000000000001,0.20199999999999999,0.06,0.505,0.369,0.022000000000000002,0.409,0.195,0.14800000000000002
24Q229,Amira,queens,Elementary,1385,hi my name is Amira I'm graduating this year 2 good teachers to ask about is Ms.Mcman there are two so the blonde haired on she is caring and a really good teacher I think she will be a perfect fit for your son also ask about=t Ms. Fazio she is kind of stick but advanced so yea.,0,0,1,2017-05-19T12:35:24,1.0,0.079,0.20800000000000002,0.08800000000000001,0.20199999999999999,0.06,0.505,0.369,0.022000000000000002,0.409,0.195,0.14800000000000002
24Q229,Nbruno22,queens,Elementary,1385,"Hi!  This is my son's zoned school for next year.  I'm wondering if someone would recommend some good Kindergarten teachers- fun, loving, high expectations, etc...My son is pretty advanced, so one that differentiates well for different style/level learners...thanks!",0,0,0,2012-01-11T00:56:30,1.0,0.079,0.20800000000000002,0.08800000000000001,0.20199999999999999,0.06,0.505,0.369,0.022000000000000002,0.409,0.195,0.14800000000000002
24Q229,Simpliv,queens,Elementary,1385,I am from the graduating class of 1973. Kindergarten was in the old school and we began in the new school in first grade.I was curious if they ever have reuions. I have such fond memories and moved to a different state and lost contact in 1976. I became a dance teacher.,0,0,0,2010-11-15T13:22:50,1.0,0.079,0.20800000000000002,0.08800000000000001,0.20199999999999999,0.06,0.505,0.369,0.022000000000000002,0.409,0.195,0.14800000000000002
24Q229,student,queens,Elementary,1385,<p>I was a PS 229 graduate. It was a really fun experience . I especially remember the picnic and cruise trips we had in my 6th grade year.</p>,1,0,0,2010-03-24T19:02:50,1.0,0.079,0.20800000000000002,0.08800000000000001,0.20199999999999999,0.06,0.505,0.369,0.022000000000000002,0.409,0.195,0.14800000000000002
24Q229,Anonymous,queens,Elementary,1385,"PS 229 won&nbsp;the Sanitation Department's annual Golden Apple competition, according to <A href=""http://psrdev2/editor/""http://www.nydailynews.com/ny_local/queens/2008/06/30/2008-06-30_public_school_229_captures_citywide_hono.html"""">a recent article</A> in the Daily News. The school bolstered its recycling program and reduced its garbage output by 63 percent. The award's $7,000 prize will go to furthering&nbsp;the school's green efforts, an assistant principal said. ""It's good that we won the award because we tried our best to do it,"" the article quoted one 4th grader as saying. ""Especially because we all do our best to help out the school.""",0,0,0,2008-07-07T19:46:44,1.0,0.079,0.20800000000000002,0.08800000000000001,0.20199999999999999,0.06,0.505,0.369,0.022000000000000002,0.409,0.195,0.14800000000000002
24Q229,Anonymous,queens,Elementary,1385,"""I love that my child is exposed to other children who have special needs, that both sides are exposed to one another,"" says one parent.",0,0,0,2007-04-30T16:45:33,1.0,0.079,0.20800000000000002,0.08800000000000001,0.20199999999999999,0.06,0.505,0.369,0.022000000000000002,0.409,0.195,0.14800000000000002
24Q229,Anonymous,queens,Elementary,1385,"""Our students represent 62 nationalities,"" says the PTA Co-President Helen Delaney.",0,0,0,2007-04-30T16:45:18,1.0,0.079,0.20800000000000002,0.08800000000000001,0.20199999999999999,0.06,0.505,0.369,0.022000000000000002,0.409,0.195,0.14800000000000002
24Q229,Anonymous,queens,Elementary,1385,"PS 229 was identified by <A href=""http://www.schoolmatters.com/pdf/achievement-gap/ny-achievement-gap-schools-schoolmatters.pdf"">Standard and Poor's School Evaluation Services</A> as having reduced the achievement gap between its students who are economically disadvantaged and those who are not.",0,0,0,2006-11-21T15:42:29,1.0,0.079,0.20800000000000002,0.08800000000000001,0.20199999999999999,0.06,0.505,0.369,0.022000000000000002,0.409,0.195,0.14800000000000002
24Q229,Adeddickbastard,queens,Elementary,1385,"Sofia, a student, writes to say that she agrees that the school is overcrowded and also that the PTA supports the school and its students.",0,0,0,2006-01-17T20:05:04,1.0,0.079,0.20800000000000002,0.08800000000000001,0.20199999999999999,0.06,0.505,0.369,0.022000000000000002,0.409,0.195,0.14800000000000002
24Q229,Dana R. Poirier,queens,Elementary,1385,"<P>""The PTA does a great job in support of the school, but classes are overcrowded,"" and there is too much emphasis on state and city tests, writes a parent. She complains that the new teaching methods don't have enough spelling and grammar, and that children don't learn cursive writing.  </P>
<P>In response to the comment above, Principal Sibylle Ajwani writes that the school has reduced class sizes in grades K, 1, 3 and 4, and ""even in the other grades, compared to other schools in the district, we have rather small registers."" She also writes that while there is ""some emphasis"" on testing as tests approach, ""we use a balanced literacy approach and certainly focus on spelling and grammar. Our students also learn cursive writing."" Finally, she agrees with the parent that ""our PTA does a great job in support of our school.""  </P>",0,0,0,2005-12-12T16:52:33,1.0,0.079,0.20800000000000002,0.08800000000000001,0.20199999999999999,0.06,0.505,0.369,0.022000000000000002,0.409,0.195,0.14800000000000002
24Q239,Michelle Rivera,queens,Elementary,486,"When will update your Insideschools review as it is based on findings from 2 years ago???  This school has a brand NEW administration with amazing teachers, staff and programs for students.",0,0,0,2016-09-30T13:40:47,1.0,0.27,0.261,0.08199999999999999,0.079,0.226,0.737,0.14400000000000002,0.012,0.774,0.066,0.20199999999999999
24Q239,newslink,queens,Elementary,486,"A teacher writes that the school has a ""new beautiful building that is 11 years old"" but that staff turnover is high because of dissatisfaction with the administration. 

""The demands placed on teachers is so exhausting 
that there isn't enough time in the day or night. Inventive spelling in 
Kindergarten never transitioned into connecting sight words and reading abilities. Teachers are required to keep extensive records and data in order to document the progress of the students.... 

""Staff members don't trust one another. Behavior is an issue... this is a PBIS (Positive Behavior Incentive School) school which means teachers are only supposed to reward the positive rather 
that criticize the negative. The guidance Counselor is involved with so 
many programs she is hardly available to assist when issues arise. 

""There are 5 ESL teachers that work with students in small groups
While there is a Coach on staff for both Lit and Math, she is hardly ever there. 

""K and 1st uses some components of ReadyGen for Literacy however the lessons need to be re-written because Ms Connolly doesn't think they are rigorous enough. There is No literacy curriculum for grades 2-5 leaving teachers on their own to plan from scratch. The Literacy coach is supposed to provide checklists for teachers with barely any information. The AP gives specific instruction NOT to collaborate or share information with other teachers. There are very few planned grade level meetings.

""LECTURES: The idea for Lectures came from the AP Ms Rudolph. The lectures are given to 3rd-5th graders in science, social studies and theater where 2 to 3 classes gather in the auditorium. Many movies are shown to the kids which leads to discussions.

""There is a theater arts teacher but no performances coordinated for the building or families at all during the year. The beautiful state of the art auditorium is used for movies, start of day and dismissal.

""One class began the year with 37 students which is 5 over the cap.
Most classes have 32 students with many issues both academic and behavior. There is no dedicated SAVE room yet the SAVE room is in effect often. SAVE room students often get taken to different rooms each period throughout the day. They are often put on the computer or get to play games with the supervising teacher. 

""Technology has many issues. Only some rooms have smart boards. Many Mac laptops haven't been updated since 2009. 

""The cluster teachers teach: Theater, Science, SS, Art and PE. All have dedicated rooms except for the SS cluster. There is a Library and a Librarian that sees only a few classes a week. There are 2 reading intervention teachers, 3 speech teachers, 2 PTs and an OT.""",0,0,0,2014-05-12T21:58:42,1.0,0.27,0.261,0.08199999999999999,0.079,0.226,0.737,0.14400000000000002,0.012,0.774,0.066,0.20199999999999999
24Q239,TheatreGuy109,queens,Elementary,486,"As a teacher at PS 239 I have learned that the presentation of our individual work comes in all imaginative, creative and multi faceted shapes and sizes. I have also become aware that this
is not completely clear to everyone in our school community. A large public performance for the school and our student’s parents is not the only way to showcase a theatrical presentation. We are a multi faceted school and as
professional educators we can make decisions to show how we present our student work to our school community. These presentations can come in many art forms and structures. 

In place of flashy Broadway productions, I chose to focus this year on the artisanal off Broaway approach to theatre. The studio 109 classroom has been transformed into a black box
theater by the theater arts teacher at PS 239 and has been twice evaluated as highly effective during the 2013-2014-school term. Parents are invited to the studio 109 classroom for individual class performances that in the past have left an emotional impact on parents, teachers, students and administrators.

 In addition to these types of presentations, our fourth grade students with the assistance of our third grade students have
recently wrapped a five-month class film project. The project consisted of scripts they wrote, acted, and directed while assisting in all areas of the production of this ten-minute film.  Their work is presented in the schools beautiful state of the art auditorium for the entire school community during carnival day in June. The student created film is the only film running on this day as it repeats every twenty minutes for a full day
schedule for the entire school. The students also get the Oscar treatment as they receive awards for their work. This project and unit has inspired many future artists to pursue an education in media. 

I understand as educators we can get emotional when we grieve but it’s important to have all our facts straight before we do.",1,0,1,2014-06-02T13:09:29,1.0,0.27,0.261,0.08199999999999999,0.079,0.226,0.737,0.14400000000000002,0.012,0.774,0.066,0.20199999999999999
24Q239,SciGui78,queens,Elementary,486,"Before one makes strong accusations toward one’s co-workers and administration, one might be best advised to fact check the data. 

The first claim: “that turnover is high because of dissatisfaction with the administration,” contradicts the Inside Schools data- the platform you chose to express your opinion. According to said data, 91% claim that the “principal is
an effective manager,” 12% higher than the city average. 80% of all teachers would recommend PS 239 to other parents. 

You also stated that. “Behavior is an issue... this is a PBIS (Positive Behavioral Incentive School) school which means teachers are only supposed to reward the positive rather than criticize the negative.” 

PS 239 is a Positive Behavioral Intervention and Supports (PBIS) school, which does encourage all of us to reinforce positive behaviors. PBIS, as stated in previous meetings, takes the average school 3-5 years to be fully operationalized. Any solid system worth its salt takes time to develop, monitor,
analyze and re-adjust. Regardless, IS data claims that 99% of all teachers believe that “order and discipline are maintained.” 

I find your statement that staff members “don’t trust one another” to be odd and perplexing. Staff who don’t trust one another, don’t spend time with one another outside of school, attend happy hours together, or engage in very fun end-of-the-year parties. WE do all of the above, and WE do it with panache.

Your observation about “lectures” and teachers “instructed not to collaborate” is also contradictory. Lectures were formed in order for horizontal collaboration to take place! Issues of course arise, but lectures are utilized to strengthen
the academic skills of our school’s population. 

I’m open to anyone who wishes to express their opinion, but opinions can not be publicly expressed solely based on trivial observations. One runs the dangerous risk of misleading the
public viewer, purposely or otherwise. When these types of gross misrepresentations are written it seems as though one’s intent is to defame the character of the school; unfortunately all stakeholders suffer from such slander.",35,0,1,2014-05-30T22:25:48,1.0,0.27,0.261,0.08199999999999999,0.079,0.226,0.737,0.14400000000000002,0.012,0.774,0.066,0.20199999999999999
24Q239,newslink,queens,Elementary,486,"Mayor de Blasio and schools chancellor Fariña visited PS 239 to read to a pre-k class and to encourage parents to enroll their children in pre-k for the fall. Read more <a href=""http://newyork.cbslocal.com/2014/04/02/mayor-de-blasio-announces-4200-additional-pre-k-seats-urges-parents-to-enroll/"">here</a>.",1,0,0,2014-04-03T13:20:06,1.0,0.27,0.261,0.08199999999999999,0.079,0.226,0.737,0.14400000000000002,0.012,0.774,0.066,0.20199999999999999
24Q239,Anonymous,queens,Elementary,486,"The parent coordinator said that the keys to the school's success are ""We work as a team"" and ""Everyone is made to feel welcome.""",4,0,0,2005-06-20T19:27:06,1.0,0.27,0.261,0.08199999999999999,0.079,0.226,0.737,0.14400000000000002,0.012,0.774,0.066,0.20199999999999999
24Q290,newslink,queens,Elementary,552,"PS 290 was named after the first female vice presidential candidate and three-term Congresswoman of the Ninth District, according to a DOE <A href=""http://schools.nyc.gov/Offices/mediarelations/NewsandSpeeches/2012-2013/Ferraro_Campus_2013040425.htm"">Press Release</a>.",0,0,0,2013-10-22T17:16:08,1.0,0.10099999999999999,0.11199999999999999,0.004,0.35600000000000004,0.08,0.402,0.165,0.031,0.48,0.28800000000000003,0.094
24Q290,Stacy,queens,Elementary,552,"Finding this school was like winning the lottery. My daughter looks forward to going to school everyday. She has learned a lot from Sept until now and she's still learning.The teachers are wonderful, the curriculum is brilliant and principal is great.   ",8,0,0,2012-02-29T02:18:35,1.0,0.10099999999999999,0.11199999999999999,0.004,0.35600000000000004,0.08,0.402,0.165,0.031,0.48,0.28800000000000003,0.094
24Q290,Flor,queens,Elementary,552,This school is a hidden gem in Maspeth Queens.  There is an atomsphere of community and unity in this school.  The principal is brilliant and innovative.  She knows each scholar by name.  I am confident these children are on the path to excellence.,21,0,0,2011-03-02T23:08:54,1.0,0.10099999999999999,0.11199999999999999,0.004,0.35600000000000004,0.08,0.402,0.165,0.031,0.48,0.28800000000000003,0.094
